{
  "mappings": [
    {
      "air_id": "AIR-STMT-E87BE3D9122E",
      "generated_block": "RUST-00001",
      "requirements": [
        "PWR-HLR-013",
        "PWR-HLR-014"
      ],
      "source_id": "ASCP-SRC-STMT-E87BE3D9122E",
      "span": {
        "column": 1,
        "end": 5973,
        "end_column": 7,
        "end_line": 154,
        "line": 40,
        "start": 1077
      },
      "tests": [
        "TEST-PWR-INVALID-001",
        "TEST-PWR-RUNTIME-001"
      ]
    },
    {
      "air_id": "AIR-DEC-EB272A2D98BB",
      "generated_block": "RUST-00002",
      "requirements": [
        "PWR-HLR-013",
        "PWR-HLR-014"
      ],
      "source_id": "ASCP-SRC-DEC-EB272A2D98BB",
      "span": {
        "column": 4,
        "end": 1093,
        "end_column": 17,
        "end_line": 40,
        "line": 40,
        "start": 1080
      },
      "tests": [
        "TEST-PWR-INVALID-001",
        "TEST-PWR-RUNTIME-001"
      ]
    },
    {
      "air_id": "AIR-COND-EFE56C86C850",
      "generated_block": "RUST-00003",
      "requirements": [
        "PWR-HLR-013",
        "PWR-HLR-014"
      ],
      "source_id": "ASCP-SRC-COND-EFE56C86C850",
      "span": {
        "column": 4,
        "end": 1093,
        "end_column": 17,
        "end_line": 40,
        "line": 40,
        "start": 1080
      },
      "tests": [
        "TEST-PWR-INVALID-001",
        "TEST-PWR-RUNTIME-001"
      ]
    },
    {
      "air_id": "AIR-STMT-22EA36CE7782",
      "generated_block": "RUST-00004",
      "requirements": [
        "PWR-HLR-013",
        "PWR-HLR-014"
      ],
      "source_id": "ASCP-SRC-STMT-22EA36CE7782",
      "span": {
        "column": 5,
        "end": 5926,
        "end_column": 13,
        "end_line": 151,
        "line": 41,
        "start": 1103
      },
      "tests": [
        "TEST-PWR-INVALID-001",
        "TEST-PWR-RUNTIME-001"
      ]
    },
    {
      "air_id": "AIR-STMT-BCE73FB5DDAD",
      "generated_block": "RUST-00005",
      "requirements": [
        "PWR-HLR-001"
      ],
      "source_id": "ASCP-SRC-STMT-BCE73FB5DDAD",
      "span": {
        "column": 13,
        "end": 1523,
        "end_column": 19,
        "end_line": 50,
        "line": 44,
        "start": 1262
      },
      "tests": [
        "TEST-PWR-STARTUP-WAIT-001",
        "TEST-PWR-STARTUP-READY-001"
      ]
    },
    {
      "air_id": "AIR-DEC-A2A44279A13D",
      "generated_block": "RUST-00006",
      "requirements": [
        "PWR-HLR-001"
      ],
      "source_id": "ASCP-SRC-DEC-A2A44279A13D",
      "span": {
        "column": 16,
        "end": 1386,
        "end_column": 39,
        "end_line": 46,
        "line": 44,
        "start": 1265
      },
      "tests": [
        "TEST-PWR-STARTUP-WAIT-001",
        "TEST-PWR-STARTUP-READY-001"
      ]
    },
    {
      "air_id": "AIR-COND-46486C3E7B4D",
      "generated_block": "RUST-00007",
      "requirements": [
        "PWR-HLR-001"
      ],
      "source_id": "ASCP-SRC-COND-46486C3E7B4D",
      "span": {
        "column": 16,
        "end": 1287,
        "end_column": 38,
        "end_line": 44,
        "line": 44,
        "start": 1265
      },
      "tests": [
        "TEST-PWR-STARTUP-WAIT-001",
        "TEST-PWR-STARTUP-READY-001"
      ]
    },
    {
      "air_id": "AIR-COND-B1E7AF6F9325",
      "generated_block": "RUST-00008",
      "requirements": [
        "PWR-HLR-001"
      ],
      "source_id": "ASCP-SRC-COND-B1E7AF6F9325",
      "span": {
        "column": 17,
        "end": 1323,
        "end_column": 32,
        "end_line": 45,
        "line": 45,
        "start": 1308
      },
      "tests": [
        "TEST-PWR-STARTUP-WAIT-001",
        "TEST-PWR-STARTUP-READY-001"
      ]
    },
    {
      "air_id": "AIR-COND-933AFAC55E2F",
      "generated_block": "RUST-00009",
      "requirements": [
        "PWR-HLR-001"
      ],
      "source_id": "ASCP-SRC-COND-933AFAC55E2F",
      "span": {
        "column": 36,
        "end": 1342,
        "end_column": 51,
        "end_line": 45,
        "line": 45,
        "start": 1327
      },
      "tests": [
        "TEST-PWR-STARTUP-WAIT-001",
        "TEST-PWR-STARTUP-READY-001"
      ]
    },
    {
      "air_id": "AIR-COND-D765DACDD027",
      "generated_block": "RUST-00010",
      "requirements": [
        "PWR-HLR-001"
      ],
      "source_id": "ASCP-SRC-COND-D765DACDD027",
      "span": {
        "column": 16,
        "end": 1386,
        "end_column": 39,
        "end_line": 46,
        "line": 46,
        "start": 1363
      },
      "tests": [
        "TEST-PWR-STARTUP-WAIT-001",
        "TEST-PWR-STARTUP-READY-001"
      ]
    },
    {
      "air_id": "AIR-STMT-4852C2496F28",
      "generated_block": "RUST-00011",
      "requirements": [
        "PWR-HLR-001"
      ],
      "source_id": "ASCP-SRC-STMT-4852C2496F28",
      "span": {
        "column": 17,
        "end": 1424,
        "end_column": 33,
        "end_line": 47,
        "line": 47,
        "start": 1408
      },
      "tests": [
        "TEST-PWR-STARTUP-WAIT-001",
        "TEST-PWR-STARTUP-READY-001"
      ]
    },
    {
      "air_id": "AIR-DEC-BBC0832C9670",
      "generated_block": "RUST-00012",
      "requirements": [
        "PWR-HLR-001"
      ],
      "source_id": "ASCP-SRC-DEC-BBC0832C9670",
      "span": {
        "column": 19,
        "end": 1465,
        "end_column": 41,
        "end_line": 48,
        "line": 48,
        "start": 1443
      },
      "tests": [
        "TEST-PWR-STARTUP-WAIT-001",
        "TEST-PWR-STARTUP-READY-001"
      ]
    },
    {
      "air_id": "AIR-COND-824107AE33E7",
      "generated_block": "RUST-00013",
      "requirements": [
        "PWR-HLR-001"
      ],
      "source_id": "ASCP-SRC-COND-824107AE33E7",
      "span": {
        "column": 19,
        "end": 1465,
        "end_column": 41,
        "end_line": 48,
        "line": 48,
        "start": 1443
      },
      "tests": [
        "TEST-PWR-STARTUP-WAIT-001",
        "TEST-PWR-STARTUP-READY-001"
      ]
    },
    {
      "air_id": "AIR-STMT-6D50A2C7A880",
      "generated_block": "RUST-00014",
      "requirements": [
        "PWR-HLR-001"
      ],
      "source_id": "ASCP-SRC-STMT-6D50A2C7A880",
      "span": {
        "column": 17,
        "end": 1504,
        "end_column": 34,
        "end_line": 49,
        "line": 49,
        "start": 1487
      },
      "tests": [
        "TEST-PWR-STARTUP-WAIT-001",
        "TEST-PWR-STARTUP-READY-001"
      ]
    },
    {
      "air_id": "AIR-STMT-6F7682246674",
      "generated_block": "RUST-00015",
      "requirements": [
        "PWR-HLR-002",
        "PWR-HLR-008"
      ],
      "source_id": "ASCP-SRC-STMT-6F7682246674",
      "span": {
        "column": 13,
        "end": 2742,
        "end_column": 19,
        "end_line": 73,
        "line": 54,
        "start": 1705
      },
      "tests": [
        "TEST-PWR-DUAL-CRITICAL-001",
        "TEST-PWR-DUAL-LOCKOUT-001"
      ]
    },
    {
      "air_id": "AIR-DEC-8C1AAF3C5949",
      "generated_block": "RUST-00016",
      "requirements": [
        "PWR-HLR-002",
        "PWR-HLR-008"
      ],
      "source_id": "ASCP-SRC-DEC-8C1AAF3C5949",
      "span": {
        "column": 16,
        "end": 1751,
        "end_column": 59,
        "end_line": 54,
        "line": 54,
        "start": 1708
      },
      "tests": [
        "TEST-PWR-DUAL-CRITICAL-001",
        "TEST-PWR-DUAL-LOCKOUT-001"
      ]
    },
    {
      "air_id": "AIR-COND-63B49803733D",
      "generated_block": "RUST-00017",
      "requirements": [
        "PWR-HLR-002",
        "PWR-HLR-008"
      ],
      "source_id": "ASCP-SRC-COND-63B49803733D",
      "span": {
        "column": 16,
        "end": 1727,
        "end_column": 35,
        "end_line": 54,
        "line": 54,
        "start": 1708
      },
      "tests": [
        "TEST-PWR-DUAL-CRITICAL-001",
        "TEST-PWR-DUAL-LOCKOUT-001"
      ]
    },
    {
      "air_id": "AIR-COND-14A07CAD6C04",
      "generated_block": "RUST-00018",
      "requirements": [
        "PWR-HLR-002",
        "PWR-HLR-008"
      ],
      "source_id": "ASCP-SRC-COND-14A07CAD6C04",
      "span": {
        "column": 40,
        "end": 1751,
        "end_column": 59,
        "end_line": 54,
        "line": 54,
        "start": 1732
      },
      "tests": [
        "TEST-PWR-DUAL-CRITICAL-001",
        "TEST-PWR-DUAL-LOCKOUT-001"
      ]
    },
    {
      "air_id": "AIR-STMT-80CDAC22F297",
      "generated_block": "RUST-00019",
      "requirements": [
        "PWR-HLR-002",
        "PWR-HLR-008"
      ],
      "source_id": "ASCP-SRC-STMT-80CDAC22F297",
      "span": {
        "column": 17,
        "end": 1925,
        "end_column": 23,
        "end_line": 59,
        "line": 55,
        "start": 1773
      },
      "tests": [
        "TEST-PWR-DUAL-CRITICAL-001",
        "TEST-PWR-DUAL-LOCKOUT-001"
      ]
    },
    {
      "air_id": "AIR-DEC-FD89DC1C5ADD",
      "generated_block": "RUST-00020",
      "requirements": [
        "PWR-HLR-002",
        "PWR-HLR-008"
      ],
      "source_id": "ASCP-SRC-DEC-FD89DC1C5ADD",
      "span": {
        "column": 20,
        "end": 1799,
        "end_column": 43,
        "end_line": 55,
        "line": 55,
        "start": 1776
      },
      "tests": [
        "TEST-PWR-DUAL-CRITICAL-001",
        "TEST-PWR-DUAL-LOCKOUT-001"
      ]
    },
    {
      "air_id": "AIR-COND-5A81CE40A399",
      "generated_block": "RUST-00021",
      "requirements": [
        "PWR-HLR-002",
        "PWR-HLR-008"
      ],
      "source_id": "ASCP-SRC-COND-5A81CE40A399",
      "span": {
        "column": 20,
        "end": 1799,
        "end_column": 43,
        "end_line": 55,
        "line": 55,
        "start": 1776
      },
      "tests": [
        "TEST-PWR-DUAL-CRITICAL-001",
        "TEST-PWR-DUAL-LOCKOUT-001"
      ]
    },
    {
      "air_id": "AIR-STMT-53159465EEC7",
      "generated_block": "RUST-00022",
      "requirements": [
        "PWR-HLR-002",
        "PWR-HLR-008"
      ],